priority_wave,subject_area,canonical_entities,suggested_cadence,implementation_complexity,notes
1,Foundation masters,"company, project, user, vendor_organization, department, trade, wbs_code, sub_job, custom_field_definition, custom_field_option",Nightly + on-change where possible,Low-Moderate,Required before broad analytical joins
2,Financial core,"budget_view_row_current, budget_view_row_snapshot, change_event, budget_change, commitment_contract, commitment_contract_line_item, subcontractor_invoice, direct_cost, prime_contract, owner_invoice, contract_payment",Nightly for full loads; more frequent for active projects,High,Highest analytical value for executive and PX cost/change reporting
3,Project management core,"rfi, rfi_reply, submittal, submittal_response, correspondence_item, meeting, meeting_topic, form_instance",Hourly or intra-day for active projects,Moderate,"Supports coordination burden, turnaround, and accountability analytics"
4,Quality and safety,"observation, inspection, inspection_item, incident, punch_item, coordination_issue",Hourly for active projects,Moderate,Supports project-health and risk indicators
5,Field execution,"daily_log_header, daily_log_segment_event, timecard, timecard_entry, timesheet, actual_production_quantity",Hourly/intra-day where labor reporting cadence justifies it,High,Critical for labor/productivity and schedule-adjacent analytics
6,Documents and design metadata,"document_folder, document_file, drawing, drawing_revision, specification_section, specification_revision",Nightly,Moderate,Keep metadata and links first; avoid full binary mirroring in first wave
7,Workflow and advanced extensions,"workflow_instance, workflow_activity, action_plan, action_plan_item, equipment, equipment_time_entry, equipment_maintenance_event, telematics_event",Daily to hourly depending on use,High,Add after the practical model is stable
